City,Place,Ratings,Place_desc,Images
Delhi,National Gallery Of Modern Art,3.0," Following its motto of delivering an excellent world of art to its visitors, National Gallery of Modern Art, Delhi, preserves paintings and other artistic pieces dating back to 1850s. It houses a collection of more than 14,000 artworks which includes work that is as old as a hundred and fifty years.  ",https://imgstaticcontent.lbb.in/lbbnew/wp-content/uploads/sites/1/2016/01/National-Gallery-Modern-Art-New-Delhi-copy.jpg
Delhi,Lotus Temple,4.4," The Lotus Temple is one of the seven Baha'i House of Worship present around the world. Known for its stunning white petal lotus architecture, iy is one of the most visited establishments in the world.  ",https://upload.wikimedia.org/wikipedia/commons/f/fc/LotusDelhi.jpg
Delhi,Red Fort,4.4," The Red Fort is a historical fort in the old Delhi area, on the banks of Yamuna. Shah Jahan constructed it in 1639 as a result of a capital shift from Agra to Delhi. Built from red sandstone, it is home to several museums. Every year, the Indian Prime Minister unfurls the national flag here on the Independence Day.  ",https://cdn.britannica.com/75/152475-050-DA89FF0A/Red-Fort-Old-Delhi-India.jpg
Delhi,Agrasen ki Baoli,3.8," A protected monument under the Archaeological Survey of India, Agrasen ki Baoli is a 60 meter long and 15 meter wide historical step well on Halley Road, New Delhi. It is an ancient water reservoir having 103 stone steps. It is one of the most visited places in Delhi having a serene atmosphere. ",https://upload.wikimedia.org/wikipedia/commons/c/cc/Agrasen_ki_Baoli%2C_New_Delhi%2C_India_-_20070127.jpg
Delhi,Garden of Five Senses,3.0," Located in the poised Said-ul-Ajaib, the Garden of Five Senses is designed to stimulate your senses of touch, sight, smell, sound and taste and is a paradise for nature’s lovers. It is spread across 20 acres and has various themed parks, Mughal baghs, pools of water lilies, solar energy park, themed decor and many other attractions. ",https://delhitourism.travel/images/places-to-visit/headers/garden-of-five-senses-delhi-entry-fee-timings-holidays-reviews-header.jpg
Delhi,Lodhi Garden,3.8," Lodhi Gardens is a city park placed in New Delhi, spanning over 90 acres. It is a luscious garden that houses the tombs of Sayyid ruler Mohammed Shah and Lodhi King Sikandar Lodhi. It is situated between Khan Market and Safdarjung's Tomb on Lodhi Road and is a favorite spot for morning walks for the Delhiites. ",https://assets-news.housing.com/news/wp-content/uploads/2022/10/13071655/lodhi-garden-near-metro-FEATURE-compressed.jpg
Delhi,Shop at Chandni Chowk,4.3," One of the oldest markets in Old Delhi, Chandni Chowk is still an important historical site renowned for the availability of every kind of goods as well as food. It was Constructed in the 17th century by mughal ruler of India Shah Jahan. It is situated opposite the Red Fort and provides a view of the Fatehpuri Mosque. ","https://static.toiimg.com/thumb/msid-79595751,width-748,height-499,resizemode=4,imgsize-912982/.jpg"
Delhi,Shop & Eat at Dilli Haat,3.0," Designed to invoke the ambience of a traditional village fair, Dilli Haat is every shopper’s paradise, a foodie’s haven and the cultural magnet of the metro city. A flamboyant mix of vibrant colours and varied cultures, the bazaar is located in the commercial centre of South Delhi, bang opposite to the INA Market. ",https://imgstaticcontent.lbb.in/lbbnew/wp-content/uploads/sites/1/2016/10/141016_Delhi-Haat_Janakpuri.jpg
Delhi,Gurudwara Bangla Sahib,3.9," Gurudwara Bangla Sahib is one of the most important Sikh gurdwara, aka Sikh house of worship, in Delhi, India and known for its association with the eighth Sikh Guru, Guru Har Krishan, as well as the pool inside its complex, known as the 'Sarovar.' It was first built as a small temple by Sikh General Sardar Bhagel Singh in 1783, who supervised the construction of nine Sikh shrines in Delhi in the same year, during the reign of Mughal Emperor, Shah Alam II. ",https://www.hellotripper.com/static/img/drive/things/18.jpg
Delhi,Rail Museum,3.0," Located in the vicinity of Chanakyapuri, the Rail Museum aims to preserve the 163 years old railway heritage of India. Popularly known as the National Railway Museum, the museum is spread over 10 acres of land and houses some fantabulous railway memorabilia.  ",https://media.tacdn.com/media/attractions-splice-spp-674x446/0b/27/ae/a4.jpg
Delhi,Nizamuddin Dargah,3.8," This is the holy shrine of Muslim Sufi Saint Nizamuddin Chisti. The tombs of many other people from the Mughal era are present in the same area, which surround a tank. Known to be one of the top-visited places in Delhi, a vibe of spirituality and serenity seems to be omnipresent at the Hazrat Nizamuddin Dargah, where you can find throngs of devotees even in the later hours of the evening. ",https://yometro.com/images/places/hazrat-hizamuddin-dargah.jpg
Delhi,Jantar Mantar,4.3," Located in New Delhi, the Jantar Mantar was one of the five sites built by Maharaja Jai Singh II of Jaipur. The site consists of 13 architectural astronomy instruments. The main purpose of the observatory was to compile the astronomical tables and to predict the movement and timings of the sun, moon and planets.  ",https://rangandatta.files.wordpress.com/2019/02/jantarmantar-1.jpg?w=584
Delhi,Tour the National Zoological Park,4.3," Also known as Chidiya Ghar, Delhi Zoo is a favourite weekend spot among adults and children. From biggest cats to the tiniest birds, the zoo has all kinds of animals and birds. It has canteens inside for the visitors and battery-operated vehicles. ",https://img.veenaworld.com/wp-content/uploads/2021/03/National-Zoological-Park-Delhi.jpeg
Delhi,Mehrauli Archaeological Park,3.8," The Mehrauli Archaeological Park is a 200-acre archaeological site home to more than 100 magnificent monuments, and tombs from the 10th century to the British era. Some prominent monuments here are tombs of Balban and Quli Khan, Jamali Kamali mosque, and Rajon ki Baoli among others. ",https://media.assettype.com/outlooktraveller/2023-10/28f1e64a-23e2-4104-8186-5fe5d209d570/shutterstock_1068028133.jpg?w=1200&h=675&auto=format%2Ccompress&fit=max&enlarge=true
Delhi,Kingdom of Dreams,4.0," The Kingdom of Dreams, also known as KOD sits majestically in Gurugram (Previously Gurgaon) and is India's first live entertainment, leisure and theatre destination. It is a magnificent structure and glitters merrily in sector 29. It offers visitors a taste of contemporary and modern India through the means of interactive tableaus, galleys, and arts.  It is currently becoming one of the best places in Delhi for tourists and locals alike. ","https://static.toiimg.com/thumb/msid-60316029,width-400,resizemode-4/60316029.jpg"
Delhi,Mughal Gardens,3.0," Popularly known as the “soul” of the Presidential Palace, the Mughal Gardens are located inside the Rashtrapati Bhawan Complex. Designed by Sir Edwin Lutyens in the year 1917 for Lady Harding, the gardens cover a vast area of 13 acres and are a wonderful incorporation of Mughal architecture with that of British style. The gardens are also open for a certain time in the year and hence make amongst the most-sought places to visit in Delhi. ",https://c.ndtvimg.com/2023-01/hik6ol9g_amrit-udyan-gardens_625x300_28_January_23.jpg
Delhi,Rashtrapati Bhavan,4.4,Rashtrapati Bhawan is a famous monument of the British Empire which was said to be the palace of the Viceroy of India. It is now the home of the President of India. It is considered to be the best-known monument in India next to Taj Mahal and Qutub Minar.,https://cdn.britannica.com/71/250071-050-929F1562/Rashtrapati-Bhavan-Rajpath-Raisina-Hill-New-Delhi-India.jpg
Delhi," 28. Jama Masjid, Delhi ",4.4," Jama Masjid is the largest mosque in India built by Mughal Emperor Shah Jahan. The mosque hosts thousands of pilgrims each year on the holy occasion of Eid to offer special Namaz in the morning. Non-Muslims are not allowed inside the Masjid during Namaz offerings. One of the top attractions and best places to visit in Delhi, Jama Masjid gets a lot of tourist crowd other than the religious crowd. ",https://upload.wikimedia.org/wikipedia/commons/a/a4/Jama_Masjid_-_In_the_Noon.jpg
Delhi,Pick the Trends at Sarojini Market,3.0," Vibrantly coloured clothes strewn all over, tiny food stalls cramped in every nook, deafening cacophony of the salesboys and a pandemic compact environment- welcome to Sarojini Nagar, the most hep and trendy market of Delhi.  ",https://imgmedia.lbb.in/media/2019/04/5cc14ccebf03e306f9f4ec54_1556171982406.jpg
Delhi,Party at the Connaught Place,4.3," Officially named Rajiv Chowk, Connaught Place is better known as CP amongst the locals. It is one of the largest commercial and business centers in Delhi, and has been designed in two concentric circles namely Connaught's Inner Circle and Connaught's Outer Circle. Known since British era, this market has its own elegance. Known to be the most iconic structure from Lutyens Delhi, this is also among one the top places to visit in Delhi. ","https://ik.imagekit.io/pu0hxo64d/uploads/gallery/tr:w-450,h-250/parties-pictures-of-ardor-2_1-156.jpg"
Bhubaneswar,ISKCON Temple,3.4," Built by the ISKCON (International Society for Krishna Consciousness) in 1991, this temple serves as an alternative to Lord Jagannath temple of Puri as that temple is restricted to Indians. ",https://www.incredibleindia.org/content/dam/incredible-india-v2/images/places/siliguri/Iskcon-2.jpg
Bhubaneswar,Hirakud Dam,4.2," Located at a distance of 15 km from the Sambalpur district and around 305 km from Bhubaneshwar, is a small town of Hirakud, which houses a major dam established during the year 1956. This dam has been a source of tourism in this region since many years. ",https://upload.wikimedia.org/wikipedia/commons/thumb/0/00/Hirakud_Dam.jpg/800px-Hirakud_Dam.jpg
Bhubaneswar,Parasurameswara Temple,3.5,Constructed in 650 A.D. this temple is a unique specimen of Oriyan style of architecture. The most special feature of this temple is the presence of one thousand lingas in the north-west corner of the complex.,https://odishatourism.gov.in/content/dam/tourism/home/discover/attractions/temples-&-monuments/parasumraswar-temple/parasurameswar%20corosal2.jpg
Bhubaneswar,Rajarani Temple,4.1,Raja Rani Temple is situated in the capital of orissa was earlier known as Indreswara Temple.,https://imgcld.yatra.com/ytimages/image/upload/t_monuments_detailslargeimg/v1434961700/Rajarani_Temple.jpg
Bhubaneswar,Bindu Sarovara,3.4,The Bindu Sarovar or Bindu Sagar is a water tank which is believed to be sacred by Hindus. This tank is surrounded by a number of temples and lies in the vicinity of the Lingaraj Temple.,https://thebackpackman.files.wordpress.com/2015/04/bindu-sarovar-bhubaneswar.jpg?w=640
Bhubaneswar,Orissa State Museum,3.1,The Orissa State museum has an exclusive collection of some unique and ancient art and craft objects.,https://odishatourism.gov.in/content/dam/tourism/home/discover/attractions/museum/odisha-state-museum/gallery/2.jpg
Bhubaneswar,Brahmeshwara Temple,3.1," The Brahmeshwara Temple is yet another relic of the brilliance of Oriyan style of architecture. Built in the 11th century, this temple is surrounded by four smaller shrines. ",https://bhubaneswartourism.in/images//tourist-places/brahmeshwara-temple-bhubaneswar/brahmeshwara-temple-bhubaneswar-tourism-opening-time-closing.jpg
Bhubaneswar,Tikarpada Wildlife Sanctuary,3.1," Tikarpada is a small town nestled on the banks of River Mahanadi, situated at a distance of 160 km from the capital city of Bhubaneshwar. ",https://www.odtravels.in/playground/themes/images/about-odisha/odisha-wildlife/tikarpada-wildlife-sanctuary/img02.jpg
Bhubaneswar,Mukteswara Temple,3.1,Mukteswara Temple dedicated to Lord Shiva is a 10th century temple and presents a quintessential example of the longevity of the Kalinga style of architecture.,https://www.astroved.com/astropedia/assets/images/temples/mukteswara.jpg
Goa,Fun time in Calangute Beach,4.4," Calangute is the largest beach in north Goa stretching from Candolim to Baga. It is a hub for tourists and backpackers as it is the perfect place to look for accommodation. It is known for the beach shacks and water sports like parasailing, water surfing, banana ride and jet-skiing.  ",https://images.unsplash.com/photo-1597820334272-af87b2d917c1?q=80&w=1556&auto=format&fit=crop&ixlib=rb-4.0.3&ixid=M3wxMjA3fDB8MHxwaG90by1wYWdlfHx8fGVufDB8fHx8fA%3D%3D
Goa,Fort Aguada,4.4,Fort Aguada is a 17th-century Portuguese fort looking out at the confluence of Mandovi River and the Arabian Sea. The crumbling ramparts of the fort stand on the Sinquerim Beach. The highlight of the fort is a lone four-storey lighthouse (which is one-of-its-kind in Asia) and a stunning view of the sunset.,https://images.unsplash.com/photo-1590690020896-4032b8ad564c?q=80&w=1632&auto=format&fit=crop&ixlib=rb-4.0.3&ixid=M3wxMjA3fDB8MHxwaG90by1wYWdlfHx8fGVufDB8fHx8fA%3D%3D
Goa,Dine on a Cruise,4.3," Cruise in Goa allows one to explore the exotic scenery, pristine waters and marvel the breathtaking view of the sunset. There are several types of cruises in Goa ranging from simple evening cruises, elaborate and romantic dinner cruises, backwater cruises, and casino cruises. All of these usually originate from Miramar Beach in Panjim. ",https://mandovicruises.com/wp-content/uploads/2023/12/IMG_2391-scaled.jpg
Goa,Water Sports in Goa,4.4," Goa is a haven for water sports like kneeboarding, kite surfing, snorkelling, parasailing, paragliding, diving, and kayaking. The water sports in Goa can be enjoyed at any one of the beaches in the north or the south. You can also engage in your favorite activities through a number of licensed water sports package operators. ",https://images.unsplash.com/photo-1558281050-4c33200099c7?q=80&w=1470&auto=format&fit=crop&ixlib=rb-4.0.3&ixid=M3wxMjA3fDB8MHxwaG90by1wYWdlfHx8fGVufDB8fHx8fA%3D%3D
Goa,Behold to Dudhsagar Waterfalls,4.3," One of India's tallest waterfalls, the Dudhsagar Falls is located inside the Mollem National Park. The Dudhsagar falls should be visited during the monsoon when it is in full flow and the surrounding deciduous forests are at their verdant best. ",https://goa-casitas.com/wp-content/uploads/2019/07/Dudhsagar-Waterfalls-Close-up.jpg
Goa,Adventures of Anjuna Beach,4.4," Anjuna Beach is among the most popular beaches in North Goa, stretching almost 2km. From family outings to adrenaline-filled adventures, Anjuna Beach is famed for its golden coastline, nightclubs, beach shacks, watersports, full-moon parties and flea markets. ",https://images.unsplash.com/photo-1582972236019-ea4af5ffe587?q=80&w=1470&auto=format&fit=crop&ixlib=rb-4.0.3&ixid=M3wxMjA3fDB8MHxwaG90by1wYWdlfHx8fGVufDB8fHx8fA%3D%3D
Goa,Chapora Fort,3.7," Chapora Fort is undeniably one of the most famous forts in Goa. More popularly known as the 'Dil Chahta Hai Fort', its claim to fame was the 2001 Bollywood blockbuster shot here. A scintillating escape, it offers beautiful views of the sea and Chapora River. ",https://www.holidify.com/images/cmsuploads/compressed/Chapora_Fort_20180428123835.jpg
Goa,Basilica of Bom Jesus,4.3," The Basilica of Bom Jesus Church is a UNESCO World Heritage Site. It houses the tomb and remains of St. Francis Xavier. Even after 400 years, the remains are in a good condition and are taken out once every decade. ",https://upload.wikimedia.org/wikipedia/commons/9/9b/Basilica_of_bom_jesus_-_Front_View.jpg
Goa,Go Clubbing by the Baga Beach,4.5," One of the most popular beaches in North Goa, Baga Beach is located close to Calangute beach, around 30 Km North of Panjim. It is the perfect destination to witness the dazzling nightlife of Goa as signature places such as Britto's, Tito's and Mambos are located in the vicinity. It is also known for a vast range of water sports. ",https://plus.unsplash.com/premium_photo-1697729701846-e34563b06d47?q=80&w=1374&auto=format&fit=crop&ixlib=rb-4.0.3&ixid=M3wxMjA3fDB8MHxwaG90by1wYWdlfHx8fGVufDB8fHx8fA%3D%3D
Goa,Butterfly Beach,3.9," A little to the south of Palolem in Canacona region of Goa lies the Butterfly Beach. This beach, also known as Honeymoon Beach, is one of the most secluded and lesser-known beaches of Goa. The beach is mostly accessible by a boat (ferry) ride from the nearby beaches. ",https://dynamic-media-cdn.tripadvisor.com/media/photo-o/13/85/de/43/butterfly-beach.jpg?w=1200&h=-1&s=1
Goa,Scuba Diving in Goa,4.3," Goa is one of the few places in India offering scuba diving. Diving in Goa is not the best owing to limited underwater visibility, but it is still popular among tourists as it is a good destination for beginners to explore the delights of the underwater world. The absence of strong water current with occasional surges adds serenity to the activity. ",https://img.traveltriangle.com/blog/wp-content/uploads/2019/11/ScubaDiving-in-Goa_14th-Nov-21.jpg
Goa,Go Shopping in Goa,3.7," For carrying back an authentic Goan experience with you, you can buy some feni, cashew-nuts, Goan hats and handicrafts. There are lots of shops in Panjim, the capital where you can buy interesting stuff. Goa is also known for its hand-painted ceramics. ",https://img.veenaworld.com/wp-content/uploads/2022/01/270288265_227510789540177_4356456244578508947_n-e1641983031433.jpg
Goa,Explore Dona Paula,4.4," Dona Paula is one of the most popular tourist hangouts in Goa famous for its vast stretch of beach. The small beach is also popular as the Lover's Paradise and features a jetty (Dona Paula Jetty) adjacent to it, which provides an ethereal view of the Arabian Sea and Mormugao harbour. ",https://images.unsplash.com/photo-1641874308359-4fd2482395d9?q=80&w=1374&auto=format&fit=crop&ixlib=rb-4.0.3&ixid=M3wxMjA3fDB8MHxwaG90by1wYWdlfHx8fGVufDB8fHx8fA%3D%3D
Goa,Arambol Beach,4.4," Beautiful and serene, Arambol Beach is among the best beaches of North Goa and is relatively unexploited by tourist activities. Considered to be one of the most spectacular beaches in Goa, Arambol beach has a distinct Bohemian feel to it, which attracts tourists from all over the world. ",https://images.unsplash.com/photo-1652820330085-82a0c2b88d78?q=80&w=1474&auto=format&fit=crop&ixlib=rb-4.0.3&ixid=M3wxMjA3fDB8MHxwaG90by1wYWdlfHx8fGVufDB8fHx8fA%3D%3D
Goa,Vagator Beach,4.3," Vagator beach is one of the most beautiful beaches in Goa. It is famous for its soft white sands and imposing but beautiful rocky cliffs. The beach is divided into two major parts, namely Little Vagator, also known as Ozran Beach, and Big Vagator. It is also popular for its sweeping panoramic views, beach shacks and trance parties. ",https://media1.thrillophilia.com/filestore/3kxjr5dnkansduo1dhk6l7o3d7ho_1.jpg
Kolkata,Marvel at the Victoria Memorial,4.5," The Victoria Memorial is a large marble building, which is considered to be the pride of Kolkata. Built between 1906 and 1921, it is dedicated to the memory of Queen Victoria. Now, it is a museum and a popular tourist spot under the Ministry of Culture.  ",https://plus.unsplash.com/premium_photo-1697730414399-3d4d9ada98bd?q=80&w=1470&auto=format&fit=crop&ixlib=rb-4.0.3&ixid=M3wxMjA3fDB8MHxwaG90by1wYWdlfHx8fGVufDB8fHx8fA%3D%3D
Kolkata,Fort William,4.4," Fort William is a fort built in Kolkata on the eastern banks of the River Hooghly, the major distributary of Ganges. The magnificent structure is spread over 70.9 acres and is embellished with hundreds of arched windows that overlook lush green gardens. Meticulous stonework adorns the surface of the building. ",https://images.unsplash.com/photo-1496372412473-e8548ffd82bc?q=80&w=1614&auto=format&fit=crop&ixlib=rb-4.0.3&ixid=M3wxMjA3fDB8MHxwaG90by1wYWdlfHx8fGVufDB8fHx8fA%3D%3D
Kolkata,Belur Math,4.4," Belur Mutt is the headquarters of the Ramakrishna Math and Mission, founded by Swami Vivekananda. Situated on the west bank of Hooghly River, the temple is prominent for its architecture that embraces Hindu, Christian and Islamic styles and stands as an icon of unity of all religions. ",https://media.istockphoto.com/id/843015742/photo/belur-math-kolkata.jpg?s=1024x1024&w=is&k=20&c=ddK_KH_QuAf8kxd7ltNZV4AGB4X8-Mj4iqir-GEkKq0=
Kolkata,Evening Walk along the Howrah Bridge,4.4," Located over the Hooghly river in West Bengal, Howrah Bridge or the Rabindra Setu is the main connection between Howrah and Kolkata.  It is a cantilever bridge and is regarded as one of the busiest ones among them.  ",https://images.unsplash.com/photo-1619816907543-783c62c7f9b0?q=80&w=1499&auto=format&fit=crop&ixlib=rb-4.0.3&ixid=M3wxMjA3fDB8MHxwaG90by1wYWdlfHx8fGVufDB8fHx8fA%3D%3D
Kolkata,Birla Planetarium,4.4," The Birla Planetarium in Kolkata, is the largest planetarium in Asia and the second largest planetarium in the world. It is a single-storeyed circular structure designed in the typical Indian style whose architecture is designed on the Buddhist Stupa at Sanchi.  ",https://media.istockphoto.com/id/1279673331/photo/nehru-planetarium-in-new-delhi-india.jpg?s=1024x1024&w=is&k=20&c=dZ84hcakRgPU-JK_QgvgrXWwO-EKd-ZLHQvPllluQ4I=
Kolkata,Indian Museum,4.4," The Indian Museum is one of the oldest museums of the world boasting some of the most exquisite collections of ornaments, fossils, skeletons, antiques, armors, mummies and stunning Mughal paintings.  ",https://images.unsplash.com/photo-1598431415889-f712fa9c5c50?q=80&w=1470&auto=format&fit=crop&ixlib=rb-4.0.3&ixid=M3wxMjA3fDB8MHxwaG90by1wYWdlfHx8fGVufDB8fHx8fA%3D%3D
Kolkata,Marble Palace Mansion,3.7," The Marble palace near the Chorbagan in North Kolkata built in 1835 by Rajendra Mallick is famed for its art collection of masterpieces by Reuben and paintings by various renowned international artists such as Reynolds, Van Gogh and Rembrandt. ",https://kolkatatourism.travel/images//tourist-places/marble-palace-mansion-kolkata/marble-palace-mansion-kolkata-tourism-entry-ticket-price.jpg
Kolkata,Mother House,3.7,This is the place where the Tomb of Mother Teresa is present. It is maintained by her missionaries and followers who have continued to promote her legacy.,https://guidetour.in/wp-content/uploads/2018/08/Mother-House-Kolkata.jpg
Kolkata,Take a tour of Science city,3.8," One of its kind in India, the Science city was inaugurated on 1st July 1997. It is a major attraction for the residents of Kolkata as well as for the people visiting Kolkata. It is one of the finest and the largest science museums in the world and provides a fun way of learning science.  ",https://lh3.googleusercontent.com/p/AF1QipNebyxdRvlVoMS-CVtO8Hyc0ZO6NuqKON97nV4p=s1360-w1360-h1020
Kolkata,St. Paul's Cathedral,3.8," Said to be the first cathedral built in the overseas territory of the British Empire, St. Paul's Cathedral is a Anglican cathedral located in Kolkata. Also said to be the seat of the Diocese of Calcutta, it is a very fine example of Indo-Gothic style of architecture. ",https://images.unsplash.com/photo-1642695114097-179bcd3d208d?q=80&w=1487&auto=format&fit=crop&ixlib=rb-4.0.3&ixid=M3wxMjA3fDB8MHxwaG90by1wYWdlfHx8fGVufDB8fHx8fA%3D%3D
Kolkata,Relax on the Tajpur Beach,3.5," Tucked between Mandarmani and Shankarpur, Tajpur is a small town set on the Bay of Bengal's tranquil shore, just 170 kms from Kolkata. Considered to be a serene secret of West Bengal, the virgin beach is hidden away from view and is still untouched by commercialization and tourism. The highlight of the pristine beach are the hundreds of red crabs that are found on the shores, which also give a perfect crimson colour to the beach.  ",https://static2.tripoto.com/media/filter/tst/img/477309/TripDocument/1633457255_20210921_082146.jpg
Kolkata,Birla Mandir,3.9," The glowing structure that adorns the streets of Kolkata is the popular Hindu Temple, Birla Temple. Dedicated to Lord Krishna and Radha, the temple is perfect specimen of craftsmanship.  ",https://media.istockphoto.com/id/515751118/photo/birla-mandir-kolkata.jpg?s=1024x1024&w=is&k=20&c=cWUWSFS_cuZTr8Mnu8FegfnIBRUjbht2CymdTjBSupM=
Kolkata,Catch a Match at the Eden Gardens,3.8," Popular as the largest cricket stadium in the India and the second largest in the world, the Eden Gardens can seat 66,000 spectators. It is set amidst an adjoining garden where Eden- related to the one-time Governor of Aukland and her sister would stroll during the evenings.  ",https://www.seawatersports.com/img/newimage/places/catch-a-match-at-the-eden-gardens.png
Kolkata,Catch the Shows at Jorasanko Thakur Bari,3.3," Currently located on the Rabindra Bharati University campus in Jorasank, Jorasanko Thakur Bari is the house in which the first non-European Nobel laureate and poet, Rabindranath Tagore was born. ",https://dynamic-media-cdn.tripadvisor.com/media/photo-o/08/08/56/a8/jorasanko-thakur-bari.jpg?w=1200&h=1200&s=1
Kolkata,Take a Toure of Birla Industrial & Technological Museum,3.9," Being the first scientific and industrial museum in India, Birla Industrial and Technological Museum (BITM) is one of the prime attractions of Kolkata. It is famous for its galleries and 3D shows. ",https://media.istockphoto.com/id/1361800484/photo/writers-building.jpg?s=1024x1024&w=is&k=20&c=bBisUVvxhJihATVDYTSqL4D4VBuI1rpSsF8_ExP-o70=
Kolkata,Rabindra Sarovar,3.3," The erstwhile Dhakuri lake is an artificial tank spread over 75 acres and is home to various migratory birds from Siberia and Russia. The lake is surrounded by gardens, children's park an auditorium, making it a popular recreational spot perfect for idyllic picnics making it one of the unique places to visit in Kolkata. ",https://yometro.com/images/places/rabindra-sarobar.jpg
