City,Place,Ratings,Place_desc,Images
Kolkata,Kalighat Temple,3.4," Kalighat Temple, one of the 51 Shakti Sthals of India, is one of the most visited Kali temples in India. The spot is where the toes of Sati's right foot fell during Shiva's Rudra Taandav naach. ",https://kolkatatourism.travel/images/places-to-visit/headers/kalighat-kali-temple-kolkata-tourism-entry-fee-timings-holidays-reviews-header.jpg
Kolkata,Shobhabajar Rajbari,3.1," The Shobhabazar Rajbari is one of the grandest Bengali style houses ever built. It was build by the Royal family of Shobhabazar in Kolkata, and the grandeur is only palpable to the eye. ",https://www.holidify.com/images/compressed/5718.jpg
Kolkata,Get close to Nature in the Botanical Gardens,3.3," The Botanical Gardens of Calcutta were founded by Robert Kyd in 1787. Protected by the Botanical Survey of India, it stretches over 109 hectares. A Banyan tree in the garden, of more than 330 m circumference, known as The Great Banyan, is the largest tree in the world. The Botanic Gardens of Kolkata were later renamed Acharya Jagadish Chandra Indian Botanic Garden. ",https://whereangiewanders.com/wp-content/uploads/2021/06/Botanical-Gardens-of-the-world.jpg.webp
Kolkata,Nakhoda Mosque,3.3," Placed in the Chitpur area in the Burrabazar business district, Nakhoda mosque is one of the busiest Mosques of Kolkata and dates back almost a century. The prayer hall has a seating capacity of 10000, and the domes and minarets have been constructed in keeping with the Fatehpur Sikri style of architecture. ",https://planetofhotels.com/guide/sites/default/files/styles/paragraph__hero_banner__hb_image__1880bp/public/hero_banner/Nakhoda_Masjid.jpg
Kolkata,Alipore Zoo,3.0," The Alipore Zoo, also known as the Calcutta Zoo or the Zoological Garden of Alipore, is the oldest zoological park to have been established in India and is a major tourist attraction in Kolkata. It attracts tourists from all across the nation who visit the zoo to explore the wildlife that happily thrives here and to enjoy themselves.  ",https://assets.telegraphindia.com/telegraph/2021/Sep/1631693522_alipore-zoo1-edited.jpg
Kolkata,Sabarna Sangrahashala,3.3," Designed, developed and maintained by Sabarrna Roy Choudhary Paribar Parishad to preserve and display the heritage of one of the well known families of Bengal- The Sabarna Roy Choudhary family. ",https://www.holidify.com/images/compressed/5719.jpg
Bangalore,Relax in Lal Bagh,4.3," Lalbagh botanical garden is home to numerous birds and wildlife and has a lake. It is popular for flower shows conducted here during Republic Day and Independence Day week. There is also a bonsai garden, topiary garden, lotus garden and rose garden inside. ",https://dynamic-media-cdn.tripadvisor.com/media/photo-o/0c/7d/47/f4/lalbagh-botanical-garden.jpg?w=1200&h=-1&s=1
Bangalore,Bannerghatta National Park,4.3," Located 22 km away, the Bannerghatta National Park is a sanctuary for a large variety of flora and fauna. The main attractions here are an aquarium, a zoo, a Children's park, Crocodile Farm, Snake Park and a Prehistoric Animals' Park. It is also popular for hiking and trekking.

 ",https://vajiramandravi.s3.us-east-1.amazonaws.com/media/2019/3/15/16/24/38/Bannerghatta-National-Park.jpg
Bangalore,Bangalore Palace,4.3,The majestic Bangalore palace is a royal palace known for its architecture with beautiful carvings both inside and outside. It is owned by the Mysore Royal family. The sprawling grounds around the palace is ideal for a picnic.,https://upload.wikimedia.org/wikipedia/commons/thumb/8/8f/Bangalore_Mysore_Maharaja_Palace.jpg/1280px-Bangalore_Mysore_Maharaja_Palace.jpg
Bangalore,Jog through Cubbon Park,4.3," Cubbon Park is the most famous attraction in Bangalore. In addition to being a natural sightseeing destination, Attara Kacheri, Cubbon Park Museum, Bangalore Aquarium and Sheshadri Iyer Memorial Park are also situated here.  ",https://dynamic-media-cdn.tripadvisor.com/media/photo-o/12/d8/95/4b/excellent-for-morning.jpg?w=1200&h=-1&s=1
Bangalore,ISKCON Temple,3.8," ISKCON Bangalore is one of the largest Krishna Hindu temples in the world. The cultural complex accommodating dedicated deities of Sri Sri Radha Krishnachandra, Sri Sri Krishna Balarama, Sri Sri Nitai Gauranga, Sri Srinivasa Govinda and Sri Prahlada Narasimha.  ",https://www.trawell.in/admin/images/upload/148027305ISKCONTemple_Main.jpg
Bangalore,Catch the Sunrise at Nandi Hills,3.3," Nandi Hills is a scenic hill station situated close to Bangalore, serving as one of the most popular destinations for trekking of Karnataka and escaping the busy city life of Bangalore. ",
Bangalore,Be amused at the Wonder La Water Park,3.5," Wonderla is the best amusement park in Bangalore. It houses water, roller coaster rides, a Ferris wheel and some VR experiences. ",https://www.tourmyindia.com/blog//wp-content/uploads/2017/05/Wonderla-Hyderabad.jpg
Bangalore,Tour the Innovative Film City,3.7," Innovative Film City is an Indian movie theme park, popular for a day trip. It houses amusement park rides, museums, adventure sports among other things.  ",https://media1.thrillophilia.com/filestore/897ovxqeqdk16y8rha3is1nbpeb9_1562757576_innovative_film_city.jpg
Bangalore,Tipu Sultan's Summer Palace,3.2," Tipu Sultan Palace was the summer residence of Tipu Sultan. It is now converted into a museum and is famous for its Indo-Islamic architecture consisting of ornamental frescoes, magnificent arches, protruding balconies and brilliant motifs. It is located inside the Bangalore Fort. ",https://www.beerandcroissants.com/wp-content/uploads/2018/09/Bengaluru-Tipus-summer-palace-front.jpg
Bangalore,National Gallery Of Modern Art,4.1," National Gallery of Modern Art is a two-storeyed museum based in a colonial-style residential building. It showcases the cultural ethos of India from periods as early as the 18th century. There is also a huge auditorium, a charming cafeteria, and a reference library here. ",https://dynamic-media-cdn.tripadvisor.com/media/photo-o/15/a7/c8/bc/national-gallery-of-modern.jpg?w=1200&h=-1&s=1
Bangalore,Shopping at Commercial Street,3.7," Commercial Street is the oldest and busiest shopping place in Bangalore. It is famous for clothes, jewellery, electronics, footwear and local food joints. ",https://superrlife.com/wp-content/uploads/2022/10/street-shoping.png
Bangalore,Art of Living International Centre,3.0," Located 21 kms southwest of Bangalore on Kanakpura Road atop Panchagiri Hills, Art of Living Centre is the headquarters of the spiritual, cultural organization Art of Living Foundation, established by Sri Sri Ravi Shankar.  ",https://bangaloreashram.org/wp-content/uploads/2019/10/V-M.jpg
Bangalore,Vidhana Soudha,3.8," Vidhana Soudha houses the State Legislature and the Secretariat of Karnataka. Popularly known as the 'Taj Mahal of South India', it is one of the most magnificent buildings in the city. It is illuminated on Sunday and public holidays. ",https://media.tacdn.com/media/attractions-splice-spp-674x446/0b/27/ac/eb.jpg
Bangalore,Explore the Universe at Jawaharlal Nehru Planetarium,3.8," Jawaharlal Nehru Planetarium is a popular attraction in Bangalore. The Sky Theatre is its main attraction which imitates the way the sky looks to us. There is also a mirror dome show, a science park, and a special programme conducted here first Sunday evening of every month. ",https://yometro.com/images/places/jawaharlal-nehru%20-planetarium.jpg
Bangalore,Visvesvaraya Industrial and Technological Museum,3.0," Visvesvaraya Industrial and Technological Museum houses machines and artefacts related to science and technology. There are also interesting shows and the ""Science for Kids"" centre here. It is a fun place to visit with kids. ",https://bangalore247.in/wp-content/uploads/2021/02/Visvesvaraya-Industrial-and-Technological-Museum-1280x720.jpg
Bangalore,Paddle over the Ulsoor Lake,3.8," Constructed by Kempe Gowda II in the 2nd century, this lake was earlier known as Halsur or Alasur. Although not fit for swimming, boating can be enjoyed at the lake. ",https://www.holidify.com/images/cmsuploads/compressed/UlsoorLake_20180304172055.jpg
Bangalore,Shiva Temple,3.2,The Shiva Temple of Bangalore is considered one of the most beautiful Shiva temples in India. It is landmarked by a huge white monolith of Lord Shiva in a an artificial pool of water and Himalayas all around.,https://www.treebo.com/blog/wp-content/uploads/2018/07/Murudeshwar.jpg
Bangalore,UB City Mall,4.3," Located in the CBD (Central Business District) in Bangalore, this luxury mall is the one-stop destination for all your high-end brand needs. It is home to all the luxury beauty, shoes, jewellery, bags and fashion brands from all around the globe. ",https://dynamic-media-cdn.tripadvisor.com/media/photo-o/08/e0/d9/9f/ub-city.jpg?w=1200&h=-1&s=1
Bangalore,Night Shopping at MG Road,4.5," MG Road is one of the most popular shopping and entertainment hubs in Bangalore. It runs from Trinity Circle to Anil Kumble Circle. Items such as traditional handicrafts, silk, sarees and cutlery and bone china are available here. MG Road is also popular for pubs and nightclubs. ",https://zolostays.com/blog/wp-content/uploads/2020/09/3-1.jpg
Bangalore,St. Mary's Basilica,3.7," St. Mary's Basilica is the oldest church in Bangalore and is the only church in the state that has been elevated to the status of a minor basilica. It is famous for the festivities it holds during the St. Mary's Feast, in September each year. ",https://its-poland.com/files/services_photos/089f8d678890fdb6e35eb93c9b48fd7c.jpg
Bangalore,Chunchi Falls,3.7," Chunchi Falls is a 50-ft high waterfall fed by the river Arkavati. It is a popular day trip from Bangalore, perfect for a family picnic. There is a watchtower on the way to falls offering a stunning view. Swimming is prohibited in the falls. ",https://4.bp.blogspot.com/-glZD3KdT1Xw/WgMoObeNrfI/AAAAAAAAAk8/xhgvvV4vu7ci0dfkW8ObtQb2tff_H-J5gCEwYBhgL/s1600/Panoramic-View-of-the-Chunchi-Falls-Kanakapura-Bangalore-Karnataka.jpg
Bangalore,HAL Aerospace Museum,3.7," HAL Aerospace Museum is India's first aerospace museum. It houses a display of various aircraft and helicopters, Aircraft engine models, Flight simulators, a mock Air Traffic Control Tower and exhibits of Indian aviation history.  ",https://media1.thrillophilia.com/filestore/bfuzo591gkgherbuabukx4fh1gik_Sahapedia-HAL-Bangalore.jpg?w=400&dpr=2
Bangalore,Go-Karting,3.7," Go-karting is the most breathtaking activities available at many places in Bangalore, which can be enjoyed with family and friends.   ","https://img.redbull.com/images/c_limit,w_1500,h_1000,f_auto,q_auto/redbullcom/2017/09/01/71a7564c-7a91-4772-b084-884cb422ebcb/the-2017-indian-national-karting-championship.jpg"
Bangalore,Bangalore Aquarium,3.7," Located in Cubbon Park, the Bangalore Aquarium is the most famous and largest aquarium in Bangalore and the second-largest in India. It offers on display a variety of ornamental and exotic cultivable fishes including Siamese Fighters, Catla, Freshwater Prawns, Goldfish, Red Tail Shark and many others.  ",https://external-preview.redd.it/bRPe8c3TFbCOMTl79qK-qGGgIkXDlbEJQPyA8YDV5r8.jpg?width=640&crop=smart&auto=webp&s=c881141d3832365dc0b1739a57f357d0e25017a9
Bangalore,Bull Temple,3.8," This temple is one of the oldest in Bengaluru, and is dedicated to Nandi, the bull who is the wagon of Lord Shiva. ",https://www.holidify.com/images/cmsuploads/compressed/3560_20190222111237jpg
Bangalore,Sankey Tank,3.0," Sankey Tank is a manmade lake, spread across an area of 37.5 acres near Vyalikaval, Malleshwaram and Sadashivanagar. The Maurya Sankey Boat Club offers guests a wide variety of boat rides, for example, rowboats, pedal boats and motorboats.  ",https://bangalore247.in/wp-content/uploads/2021/02/Sankey-Tank.jpg
Bangalore,Devanahalli Fort,3.0," Known for its historical significance and archaeological brilliance, Devanahalli Fort is located 35 kms north of the city of Bangalore. Lately in ruins, the fort once was the birthplace and residence of the great warrior Tipu Sultan.  ",https://images.deccanherald.com/deccanherald%2Fimport%2Fsites%2Fdh%2Ffiles%2Farticle_images%2F2020%2F05%2F19%2F631389-1912820672-1504550074.jpg?w=1200&ar=40%3A21&auto=format%2Ccompress&ogImage=true&mode=crop&enlarge=true&overlay=false&overlay_position=bottom&overlay_width=100
Bangalore,Maha Bodhi Society Temple,3.2," A recent addition to the temples of Bengaluru, this one houses a library with a sprawling collection of texts and books on Buddhism and is constantly the hub of a number of spiritual retreats and lectures. ",https://www.trawell.in/admin/images/upload/30879280Maha-Bodhi-Temple.jpg
Bangalore,Cycling in the Outskirts,3.2," Outskirts of Bengaluru are a cyclist's delight. One can rent a cycle from the multiple cycle groups available here such as Namma Cycle, Bums on the saddle, Bike Zone etc. ",https://blogger.googleusercontent.com/img/b/R29vZ2xl/AVvXsEhg8txAF-T56rULNv5ILWlt5CPscNy2oqtI7cbzTk1Z9hWcDvsM8Ya37HXTzDs8igVLWEdBwVqeyfk4MfWR2Okukp9sUUqbE2DFmWNkVaeYpLj-s1CcPKSQuUvv0FLZQSc71wUmmZvF1amq/s2048/20201101_173418-01.jpeg
Bangalore,Ragigudda Anjaneya Temple,3.0," Ragigudda Sri Prasanna Anjaneya Temple is dedicated to the Hindu God- Hanuman. It also houses a Shivalinga and beautiful shrines of Ram, Sita and Lakshman. ",https://dynamic-media-cdn.tripadvisor.com/media/photo-o/08/86/a5/05/ragigudda-anjaneya-temple.jpg?w=1200&h=-1&s=1
Bangalore,Venkatappa Art Gallery,3.0," Located in the premises of Karnataka Government Museum, Venkatappa Art Gallery situated on Kasturba Road, Cubbon Park flaunts over 600 paintings. Named after the most famous artist of Bangalore city - K. Venkatappa, the gallery houses resplendent works of other renowned artists as well. ",https://dc-cdn.s3-ap-southeast-1.amazonaws.com/dc-Cover-tc2qs3qkna9b6s7h3hiul8m6r3-20160401044913.Medi.jpeg
Bangalore,Halasuru Someshwara Temple,3.0," Located in the suburbs of Halasuru (Ulsoor) in Bangalore, Halasuru Someshwara Temple is dedicated to the Hindu deity Shiva. Built in around the 12th and the 13th centuries by the Hoysalas, the temple is now managed and maintained by the Endowment Department of the Karnataka government.  ",https://www.hoteldekho.com/storage/img/tourattraction/164345140557-1024x768.png
Bangalore,Find Peace under the Big Banyan Tree,3.0," The Big Banyan Tree or locally called as the Dodda Alada Mara is a 400 year old banyan tree in the village of Kethohalli near Bangalore. Sprawling over a vast 3 acres of land, the tree is one of the largest of its kind.  ",https://www.karnataka.com/wp-content/uploads/2013/04/big-banyan-tree-picnic-flickr.jpg
Bangalore,Indian Music Experience,4.0," Spread across 50,000 square feet, the Indian Music Experience in Bengaluru is the first interactive music museum of the nation that is most innovatively disrupting the conventional notion of museums among visitors. The Museum exhibits everything about Indian music under a single roof, right from classical to folk, regional and Bollywood. ",https://dynamic-media-cdn.tripadvisor.com/media/photo-o/16/e1/9a/14/instrument-gallery.jpg?w=1200&h=-1&s=1
Bangalore,Indira Gandhi Musical Fountain Park,3.0," Created in 1995 by B. N. A. Technology Consulting Limited, Hong Kong, Indira Gandhi Musical Fountain is probably the most technically advanced and one of the biggest artificially created fountains in India. Located on T. Chowdaiah Road, the enthralling fountain has been based on multimedia technology, MIDI interfaces and hardware architecture. ",https://bangalore247.in/wp-content/uploads/2021/02/Indira-Gandhi-Musical-Fountain-Park.jpg
Hyderabad,Tour the Ramoji Film city,4.2," Located on the outskirts of Hyderabad, Ramoji Film City is certified as the World's largest Film Studio Complex by the Guinness Book of World Records. It is the most famous attraction in Hyderabad. The highlights are the film city tour, Sahas Adventure and holiday carnivals. ",https://dynamic-media-cdn.tripadvisor.com/media/photo-o/12/f3/ad/28/stunt-show.jpg?w=700&h=-1&s=1
Hyderabad,Charminar,4.3," An identifying feature of the city, Charminar is the most prominent landmark of Hyderabad. It was erected by Quli Qutub Shah to signify the founding of Hyderabad. Everyone coming to the city, definitely visits the Charminar. It is also famous for the market that sprawls around it and is called 'Laad' or 'Chudi' Bazaar. ",https://hyderabadtourpackage.in/images/places-to-visit/charminar-hyderabad-entryfee-timings-tour-package-header.jpg
Hyderabad,Enjoy the Show and Food at Hussain Sagar Lake,4.3," Hussain Sagar Lake is one of a largest man-made lake situated in Hyderabad. Renowned for its monolith of Lord Buddha placed right at the center of the lake, the place is famously known as a Tank Bund, a popular spot of tourist attraction.  ",https://vivaciousanushri.files.wordpress.com/2015/11/2014-11-25_185703_hussain-sagar-lake-hyderabad.jpg
Hyderabad,Wonderla,4.4," Wonderla Amusement and Theme Park is the best water park in Hyderabad and one of the best things to do. With more than 43 fun and thrilling rides, it is a fun place for a family outing. The rides are divided into High Thrill Rides, Water Rides, Family Rides and Kids RIdes. ",https://www.hyderabadtourism.travel/administrator/cache/preview/a1e442bd507ff26537a21f43431f19c5.jpg
Hyderabad,GravityZip,4.3," GravityZip is India’s first indoor sky diving arena. It is located in  Gandipet, Hyderabad only a few minutes away from Mehdipatanam Bus Stop. It features the first of its kind indoor skydiving wind tunnel, which is the first in India. It is fun for beginners as well as professionals. The flight package consists of 2 flights of 1-minute duration. ",https://dynamic-media-cdn.tripadvisor.com/media/photo-o/23/4b/50/28/caption.jpg?w=1200&h=-1&s=1
Hyderabad,Chowmahalla Palace,4.2," The Chowmahalla Palace of Hyderabad once served as the official residence of the Nizams of Hyderabad during their reign still retains some of its past splendour. The architecture of the palace is an imposing sight to behold. The facade itself is a delicate artwork of domes, arches, windows and meticulously carved out designs. ",https://dynamic-media-cdn.tripadvisor.com/media/photo-o/03/3a/96/42/chowmahalla-palace.jpg?w=600&h=-1&s=1
Hyderabad,Golkonda Fort,4.3," Golconda Fort is a massive fortress whose ruins stand proudly even today displaying the glory of its rich past and some untold sagas of the city's history. It is reputed for being the area where once, the mighty Koh-I-Noor diamond was stored. In the evening, Golconda Fort comes to life with the light and sound show. ",https://dynamic-media-cdn.tripadvisor.com/media/photo-o/05/3b/8f/13/at-the-ground.jpg?w=800&h=-1&s=1
Hyderabad,Statue of Equality,4.3," The Statue of Equality is the second tallest sitting statue in the world at its height of 216 ft. Located in Muchintal, Hyderabad, it is a statue of Sri Bhagavad Ramanujacharya, who worked relentlessly to promote equality. It was built to commemorate his 1000th birthday. The highlights are the dancing water show with light and music and the dynamic fountain show (Leela Jala Neerjanam) held daily. ",https://dynamic-media-cdn.tripadvisor.com/media/photo-o/26/a9/28/89/caption.jpg?w=1100&h=-1&s=1
Hyderabad,Thrill City,4.0," Thrill City is a virtual reality amusement park located on Necklace Road near Sanjeeviah Park in Hyderabad. It offers a flying simulator, cricket simulator, bumping cars, a bowling alley, swimming pool, splash coaster and much more. The highlight is the world's largest single platform motion theatre. Thrill City is a fun place to visit for people of all ages. ",https://dynamic-media-cdn.tripadvisor.com/media/photo-o/20/60/b5/e6/india-s-1st-futuristic.jpg?w=1200&h=-1&s=1
Pondicherry,Play on the Paradise Beach,4.4," Paradise Beach, also known as Plage Paradiso, is situated in Chunnambar, close to Pondicherry town. Adorned with the golden sand, this is a little-isolated beach. To reach here, you have to take a ferry across the backwaters, which takes around 20-30 minutes. There are a few shacks along the main entrance to the beach, and you can get fresh coconut water and some simple snacks - don't expect any fancy street food though.  ",https://images.unsplash.com/photo-1503756234508-e32369269deb?q=80&w=1470&auto=format&fit=crop&ixlib=rb-4.0.3&ixid=M3wxMjA3fDB8MHxwaG90by1wYWdlfHx8fGVufDB8fHx8fA%3D%3D
Pondicherry,Aurobindo Ashram,3.8," The Sri Aurobindo Ashram, a spiritual community or ashram located in Pondicherry, is the outcome of a small community of disciples who had gathered around Sri Aurobindo after he retired from politics and settled in Pondicherry in 1910. On 24 November 1926, after a major spiritual realization, Sri Aurobindo withdrew from public view in order to continue his spiritual work. At this time he handed over the full responsibility for the inner and outer lives of the spiritual aspirants and the ashram to his spiritual collaborator, the Mother earlier known as Mirra Alfassa. This date is therefore generally known as the founding-day of the ashram. ",https://images.unsplash.com/photo-1490707843862-104c1ead1918?q=80&w=1470&auto=format&fit=crop&ixlib=rb-4.0.3&ixid=M3wxMjA3fDB8MHxwaG90by1wYWdlfHx8fGVufDB8fHx8fA%3D%3D
Pondicherry,Scuba Diving in Pondicherry,3.5," Packed with enchanting marine life, Pondicherry offers an amazing adventure of scuba diving off the country's East Coast.
A dive into the sea will let you explore the rich life comprising of beautiful natural coral reefs and other exotic creatures such as manta rays, kingfish, sea snakes, lionfish, butterflies, crustaceans, moray eels and many more. Apart from that, if it is your lucky day you might even spot whale sharks, even sharks, dolphins and turtles. You also have an option of enjoying the dive at an artificial reef and experience the thrill of the activity making Pondicherry an irresistible diving destination. ",https://images.unsplash.com/photo-1586508577428-120d6b072945?q=80&w=1528&auto=format&fit=crop&ixlib=rb-4.0.3&ixid=M3wxMjA3fDB8MHxwaG90by1wYWdlfHx8fGVufDB8fHx8fA%3D%3D
Pondicherry,Explore the sites of Arikamedu,3.8,Arikamedu are the ruins which carried the remnants of the Roman trade in India. Recent excavations have brought out wine jars and ancient roman coins hinting on the Roman links in the ancient history of Pondicherry.,https://media.istockphoto.com/id/1480325221/photo/photo-of-ancient-indo-french-colony-arikamedu-archaeological-site-pondicherry-india.jpg?s=1024x1024&w=is&k=20&c=wRk3FCtg7xOSo3rGkNdAB9nv6ihucRs9axmBXYPKFOc=
Pondicherry,Take a Leisure Walk by the Seaside Promenade,3.6," One of the things that does justice to Pondicherry's French Roots is its beautiful Seaside Promenade. The area is well maintained, clean and beautiful and you can actually feel foam spray on your face while sipping a cooler in one of the many cafes at the promenade. Whether you're visiting during the sunny day or the starry night, the Seaside Promenade is equally feel good. ",https://images.unsplash.com/photo-1572199350906-b4443404bfdd?q=80&w=1374&auto=format&fit=crop&ixlib=rb-4.0.3&ixid=M3wxMjA3fDB8MHxwaG90by1wYWdlfHx8fGVufDB8fHx8fA%3D%3D
Pondicherry,Pondicherry beach,3.8,Pondicherry beach is a different kind of beach with less sand and more rocks. It offers a very peaceful place to its tourists and visitors to sit and enjoy the waves.,https://images.unsplash.com/photo-1560316986-9e470bf15804?q=80&w=1374&auto=format&fit=crop&ixlib=rb-4.0.3&ixid=M3wxMjA3fDB8MHxwaG90by1wYWdlfHx8fGVufDB8fHx8fA%3D%3D
Pondicherry,Chunnambar Boat House,3.8," Chunambar is a quaint little hamlet located along Cuddalore Main Road, around 8 km from Pondicherry. This serene town is visited by tourists for its beach, which is know as Paradise Beach, situated near the mouth of the backwater. With pristine sand and crystallized water, it is a perfect place for one to spend a day out playing water sports and bathing in the sun. A short cruise is also organized for the visitors which gives them a fantastic overall view of the serene beauty of the waters. One can also spot dolphins playing around in the water making it a must-visit for the nature lovers. ",https://images.unsplash.com/photo-1610046371606-fa82a77a0035?q=80&w=1570&auto=format&fit=crop&ixlib=rb-4.0.3&ixid=M3wxMjA3fDB8MHxwaG90by1wYWdlfHx8fGVufDB8fHx8fA%3D%3D
Pondicherry,Basilica of the Sacred Heart of Jesus,3.6," This Gothic style building is a highly revered place of worship in Pondicherry. Visitors comprising of both tourists as well as devotees, who are staunch believers, visit to offer their prayers to the All Mighty here. ",https://plus.unsplash.com/premium_photo-1678233035758-f6c2fc8cc538?q=80&w=1374&auto=format&fit=crop&ixlib=rb-4.0.3&ixid=M3wxMjA3fDB8MHxwaG90by1wYWdlfHx8fGVufDB8fHx8fA%3D%3D
Pondicherry,Water Sports in Pondicherry,4.0," With a unique, peaceful coastal beauty to it, Pondicherry is quickly becoming every beach lovers' favourite hideout. A number of water sports options along its white sandy beaches are another reason for travellers to love Pondy, as it is lovingly known. ",https://ds393qgzrxwzn.cloudfront.net/resize/m720x480/cat1/img/images/0/iiogwP7kUY.jpg
Pondicherry,Botanical Garden,3.2," A popular tourist attraction of Pondicherry, Botanical Garden was established by C.S. Perrotet in the year 1862. The garden is home to several exotic varieties of rare plants as well as an aquarium. ",
Pondicherry,Take the Kids to Jawahar Toy Museum,3.3," An ideal place for kids, Jawahar Toy Museum is a well maintained place situated at the old light house building near Gandhi Maidan. The museum houses a wide range of dolls and toys collected from all over the country. ",https://unusualcollections.files.wordpress.com/2016/04/teddy-bears-pudu.jpg?w=500
