City,Place,Ratings,Place_desc,Images
Aurangabad,Bibi-ka-Maqbara,4.2," Having a striking resemblance to Taj Mahal, the Bibi ka Maqbara is often referred to as the Taj of the Deccan. Bibi ka Maqbara was constructed by Azam Shah, son of Aurangzeb in the memory of his mother Dilras Banu Begum. It is the principal monument in the historic city of Aurangabad.  ",https://upload.wikimedia.org/wikipedia/commons/7/78/The_Tomb_of_Dilras_Banu_Begum.jpg
Aurangabad,The Ajanta caves,3.6," At a distance of 99km from the town lies a highlight to its tourism and heritage spheres. These ones find themselves a place in the UN's list of World Heritage Sights and are a must visit, while here. ",https://upload.wikimedia.org/wikipedia/commons/thumb/e/e0/AJANTA_CAVES_-_C.SHELARE_%282%29.jpg/300px-AJANTA_CAVES_-_C.SHELARE_%282%29.jpg
Aurangabad,Ellora caves,3.5," Another World Heritage Site that the town boasts of, are the Ellora caves, that one must not miss while in Aurangabad. The sculptures here, represent elements of three religions and do so grandly and beautifully. ",https://www.pilgrimagetour.in/blog/wp-content/uploads/2023/12/History-of-Ellora-Caves.jpg
Aurangabad,Daulatabad Fort,4.2,Daulatabad aka Devagiri is a town which includes the Devagiri Daulatabad fort which carries the distinction of remaining undefeated in battle. It is a 14th century fort city in Maharashtra state of India about 16 kilometers northwest of Aurangabad. Earlier the place was called Devagiri when it was an important uplands city along caravan routes but the times later have reduced it to a village. However it is also considered to be one of the seven wonders of Maharashtra and a developing tourist spot.,https://www.fabhotels.com/blog/wp-content/uploads/2020/03/Daulatabad-Fort-600.jpg
Aurangabad,Aurangabad caves,4.3," The majestic caves of Aurangabad are ten in number, divided in two separate locations of Eastern and Western groups of caves. ",https://www.fabhotels.com/blog/wp-content/uploads/2020/02/Aurangabad-Caves-600.jpg
Aurangabad,Siddharth Garden and Zoo,3.2," A well maintained garden, elaborate with trees, flowers and an aquarium, rides, and a zoo, this one is ideal for some relaxed time in lush green and refreshing surroundings. ",https://aurangabadtourism.in/images/places-to-visit/header/siddharth-garden-and-zoo-aurangabad-tourism-entry-fee-timings-holidays-reviews-header.jpg
Aurangabad,Gul mandi,3.2," Every place has a distinct bazaar, so does Aurangabad. Amongst all the famous and well known ones, Gul Mandi is the largest bazaar in Aurangabad. ",https://tripginny.com/wp-content/uploads/2023/06/Gul-Mandi.png
Aurangabad,Bani Begum garden,3.2," At a distance of 24km from Aurangabad is this astonishingly beautiful garden with fountains, fluted pillars & massive domes. ",https://www.tourmyindia.com/images/bani-begam-bagh1.jpg
Aurangabad," 10. Jain Caves, Ellora ",3.2,Cave 34 is an unfinished four-pillared hall with a shrine. Another place called Samvatsarana is located in Ellora caves which was used by thirthankaras preached after attaining omniscience.,https://upload.wikimedia.org/wikipedia/commons/thumb/3/3a/Ellora_Caves%2C_India%2C_Kailasanatha_Temple_2.jpg/1200px-Ellora_Caves%2C_India%2C_Kailasanatha_Temple_2.jpg
Aurangabad," 11. The Buddhist Caves, Ellora ",3.5," The 12 Buddhist Caves mostly include viharas or monasteries. In these caves, several monasteries have shrines that are carved with paintings and sculptures of Buddha, Bodhisattva and Saints. ",https://live.staticflickr.com/6221/6359240593_4c6a580738_b.jpg
Aurangabad,Panchakki,3.7," Panchakki is a water mill located in the dargah complex at  Baba Shah Musafir Dargah, Auranagabad. It is an ancient mill which used to grind grain for the pilgrims who visited the Dargah. This mill displays the scientific thought process behind medieval Indian architecture, as in those days, it was designed to generate energy via water which was brought down from a spring on a nearby mountain. The complex, along with the mill, also consists of a mosque, a madrissa, a kacheri, a minister's house, a sarai and houses for zananas. ",https://www.hotelgrandkailash.com/images/panchakki-photo2.jpg
Aurangabad,Khuldabad,3.7," Khuldabad is a small town located around 13 km from Aurangabad and 3 km from the world heritage site of Ajanta and Ellora Caves. Formerly known as 'Rauzaa', which means the garden of paradise, Khuldabad is popular as the ""Valley of Saints"", because the city was resided by several Sufi saints in the 14th century. This holy city is home to several important historic monuments like Aurangzeb's Tomb, Dargah of Zar Zari Zar Baksh, Shaikh Burhan ud-din Gharib Chisti and Shaikh Zain-ud-din Shirazi. Khuldabad also houses the famous Bhadra Maruti Temple dedicated to Lord Hanuman. ",https://media-cdn.tripadvisor.com/media/photo-s/09/34/7b/fd/valley-of-the-sufi-saints.jpg
Aurangabad," 14. Kailasanatha and other temples, Ellora ",3.2," While Ajanta and Ellora caves are known as the world famous Buddhist monuments, they are a testimony to the fact that the three religions Hinduism, Jainism and Buddhism were one and hence there are also Hindu temples to visit here. ",https://media.licdn.com/dms/image/D4D12AQFJKmkkg-aHbA/article-cover_image-shrink_600_2000/0/1696565203905?e=2147483647&v=beta&t=7UQxNJkPZpCwsxhtwJE-seSXWQEsxGkYB6Abz89ocgw
Aurangabad,Salim Ali Lake,3.2," Surrounded by a beautiful view, one can also finds themselves spotting a number of birds here, given the bird sanctuary in the area. During the monsoons and winter months, boating facility is also available. ",https://www.marathwadatourism.com/en/wp-content/uploads/2022/08/Salim_Ali_Lake.jpg
Aurangabad,Himroo Factory,3.2," Himroo Factory falls on your list of essentials if you wish to take back home some conventional and traditional Himroo fabric, shawls and saris. ",https://images.jdmagicbox.com/comp/aurangabad-maharashtra/f7/9999px240.x240.111228134417.y6f7/catalogue/aurangabad-himroo-silk-paithani-factory-khuldabad-aurangabad-aurangabad-maharashtra-saree-manufacturers-668fh0qh4p.jpg
Aurangabad,Jama Masjid,3.2,The Jama Masjid is located near Killa Arrak. Five rows of ten polygonal pillars are connected by a system of arches. It is therefore a very intellectually constructed structure.,https://www.india-a2z.com/images/jamma1.jpg
Aurangabad,Dargah of Pir Ismail,3.2," The Dargah was built in the memory of Pir Ismail, a tutor to the then Mughal ruler, Aurangzeb. ",https://www.holidify.com/images/cmsuploads/compressed/4110_20190416231642.jpg
Aurangabad,Killa Arak,3.2," An elaborate palace with 4 entrances, this structure was built on the Mughal king, Aurangzeb's order. The throne room of Aurangzeb can be found here. ",https://www.holidify.com/images/cmsuploads/compressed/shutterstock_1039920103_20191031114856.jpg
Aurangabad,Connaught,3.7," Cannaught place or market is developing as a good market for almost everything. It has good multiplex, Prozone Mall, showrooms for cars, gold ornaments SHOWROOMS, market for mobile phones, and almost everything people need in day to day life, with plenty of flats and multi storied buildings. ",https://resize.indiatvnews.com/en/resize/oldbucket/400_-/mainnational/Delhi-s-Connaug20347.jpg
Dehradun,Robber's Cave,4.4," Robber's Cave, locally known as Gucchu Pani, is a river cave formed in the Himalayas. This river cave is believed to be an abode of Lord Shiva. Its speciality is that river water flows out from the middle of the cave.   ",https://i0.wp.com/eindiatourism.in/wp-content/uploads/2023/06/Amazing_view_of_Robber_Cave_Dehradun_Uttarakhand_India.jpg
Dehradun,Sahastradhara,4.2,Sahastradhara meaning 'thousand fold spring' is popular for its ecstatic beauty and therapeutic value since its water contains Sulphur.  Its picturesque beauty attracts a lot of travellers.,https://www.holidify.com/images/cmsuploads/compressed/Sahastradhara-Dehradun-925752519-4250723-1_20171121221603.jpg
Dehradun,Tapkeshwar Temple,4.2,Tapkeshwar is a famous cave temple on the banks of a rivulet. The water further flows in to the cave to drip on to the Shiv Linga inside. Sulphur springs present around the temple makes for a therapeutic bath. This cave was once the abode of the famous guru Dronacharya and hence is also known as Drona cave.,https://dehraduntourism.co.in/images/places-to-visit/header/tapkeshwar-temple-dehradun-tourism-entry-fee-timings-holidays-reviews-header.jpg
Dehradun,Mindrolling Monastery,4.4," The Mindrolling Monastery, also known as the Buddha Temple Complex, is the largest Buddhist Vihara of India, training monks for over 300 years. Being an architectural masterpiece with several sections, the monastery is a visual wonder. It also houses the tallest Stupa in Asia. ",https://www.tourmyindia.com/states/uttarakhand/images/mindrolling-monastery-dehradun1.jpg
Dehradun,Forest Research Institute,4.0," Established in the year 1906, the Forest Research Institute is a premier institution in the field of forestry research in India. Nestled in the serene backdrop of the Doon Valley, Forest Research Institute is also a significant tourist attraction of Dehradun. The Institute has been used to film various Bollywood films.  ",https://dehraduntourism.co.in/images//tourist-places/forest-research-institute-dehradun/forest-research-institute-dehradun-india-tourism-history.jpg
Dehradun,Paltan Bazar,3.1," Paltan Bazaar is located in the heart of Dehradun, spanning a 1.5km stretch between the Clock Tower and the railway station. From local spices, confectionery items  & street food to goods like apparel, appliances and artefacts, this busy market has it all. Considered as Dehradun's main bazaar, it is the best place for shopping in Dehradun. ",https://i.ytimg.com/vi/kjpAiRC9K9o/maxresdefault.jpg
Dehradun,Malsi Deer Park,4.1," Located at the base of the Shivalik range, Dehradun Zoo, formerly known as Malsi Deer Park, is a zoological garden. It is home to two horned Deer, tigers, Neelgai, Peacock and many other animals. This well maintained zoological garden is an ideal place for a picnic. ",https://i0.wp.com/kohleyedme.com/wp-content/uploads/2017/09/Untitled-design-7.jpg?fit=1080%2C720&ssl=1
Dehradun,Pacific Mall,4.3," The biggest and most popular shopping mall in Dehradun, Pacific Mall is known for shopping and for entertainment. It features hundreds of brands, several food joints and entertainment options which means it is a great place for individual and group shoppers. ",https://im.whatshot.in/img/2020/Apr/pacific-mall-04-1586850506.jpg?q=90
Dehradun,Clock tower,3.9," Clock tower, also known as ""ghanta ghar"" is a very famous tourist attraction. It was a renowned landmark of the city and was built by the British before India got its independence. The clock does not tick at present, but it is said that years ago when it was built, the peak of it was such that a person on the other end of the city could hear it as well. ","https://res.cloudinary.com/chasset/f_webp,h_480,w_720/hbimages/desktop/1688112245007-The-Clock-Tower-Dehradun-Uttarakhand.jpg"
Dehradun,Daat Kali Mandir Dehradun,4.5,The Daat Kali Temple in Dehradun is dedicated to the Goddess Kali. Devotees come here to seek blessings before starting a new chapter of their lives and also for the darshan of a flame that has been continuously burning since 1921.,https://www.tourmyindia.com/states/uttarakhand/images/daat-kali-temple1.jpg
Dehradun,Fun Valley,3.6,"  Located within Uttarakhand's Golden Triangle - Dehradun, Haridwar and Rishikesh, Fun Valley is an amusement park cum resort. The largest amusement and water park in North India, it is equidistant from the 3 towns. It has a water park, go-karting and shopping complexes. 
 ",https://www.euttaranchal.com/tourism/photos/fun-valley-4087665.jpg
Dehradun,Subir Raha Oil Museum,4.3," The Subir Raha Oil Museum in Dehradun, Uttarakhand showcase the different stages of the oil and gas value chain. The museum also depicts the industrial history of petroleum in India as well as the process of conservation of fossil fuels.  ",https://www.holidify.com/images/cmsuploads/compressed/subir-raha-oil-museum-dehradun-tourism-entry-fee-timings-holidays-reviews-header_20220209180057.jpeg
Dehradun,Kalinga War Memorial,3.7," Located along the Sahastradhara road, Kalinga War Memorial, or Khalanga War Memorial, was erected by the British to honor the Gurkhas. The only war memorial of its kind which was built was Britishers to honor their foe, it is a symbol of pride for Gurkha community. ",https://media-cdn.tripadvisor.com/media/photo-s/17/12/f2/20/kalinga-war-memorial.jpg
Dehradun,Lacchiwalla,4.1," Lacchiwalla is a popular picnic destination near Dehradun. Located in the forest area of Rajaji,  Lacchiwalla is famous for its greenery, picturesque cottages and hotels. The beauty of the place is heightened by the brook, flowing through the forest area.  ",https://www.holidify.com/images/cmsuploads/compressed/lacchiwalla-dehradun-india-tourism-photo-gallery_20220117125712.jpeg
Dehradun,Rajaji National Park,3.1," Rajaji National Park is home to the Tiger, Leopard, Himalayan Bear, Cheetal, hog deer, barking deer, Sambar deer, wild boar, antelopes such as the Nilgai, Goral , Jackal, Hyena, Jungle Cat, Leopard Cat, Civets, Himalayan Yellow-Throated Marten, Sloth Bears, Pythons, King Cobra, Common Krait, Indian Cobra and the Monitor Lizard and above All the Asian Elephant. ",https://cdn-web.firstrek.in/wp-content/uploads/2023/03/Rajaji-National-Park-the-Kingdom-of-the-Elephant.jpg
Dehradun,Tapovan Temple,4.0," Tapovan Ashram is located along the Dehradun-Rajpur Road. It is a picturesque valley, surrounded by lush greenery and calm meadows. Situated just above the Gangotri Glacier, the place also attracts trekking activities. The ashram also holds periodic yoga courses. ",https://media1.thrillophilia.com/filestore/1p0srzjsiyyx112uppboet8jorpf_1568965473_shutterstock_1309768168.jpg.jpg
Dehradun,Har ki Dun,3.5," Nestled away from the hustle bustle of the city, Har Ki Dun is a beautiful cradle-shaped valley with untouched panoramic beauty. Perched at an elevation of 3,566 mts above the sea level, this place is one of the remotest areas of Uttarakhand offering a plethora of trekking excursions. ",https://himalayashelter.com/wp-content/uploads/2021/08/har-ki-dun-valley.webp
Dehradun,Assan Barrage,3.9," An amazing place bustling with life, the richness of nature and beauty, Assan Barrage is a bird lover's paradise and a naturalists' heaven with its artificial lake attracting thousands of birds of varied species.  ",https://cdn-web.firstrek.in/wp-content/uploads/2023/04/2022-12-10.jpg
Dehradun,Kedarkantha Trek,3.5," Situated in the lap of mountains of the Tons River Valley, Kedarkanth is a stunning place offering an easy, classic trek. It is a lovely ridge peak accessible throughout the year with plethora of rewarding adventures. ",https://www.bikatadventures.com/images/Gallery/IMG1000X548/img-kedarkantha-trek2102-Bikat-Adventures.jpg
Dehradun,Sai Mandir Dehradun,4.0," Dedicated to Shirdi Sai Baba, the Sai Darbar Temple in Dehradun is situated along Rajpur Road. It is frequented by a plethora of devotees who come to pay their tribute to Sai Baba by offering chadars, flowers and sweets, and to attend the aarti organised every evening.  ",https://www.holidify.com/images/cmsuploads/compressed/sai-darbar-temple-dehradun-tourism-entry-fee-timings-holidays-reviews-header_20220209182722.jpeg
Dehradun,Ram Rai Gurudwara,3.7," Established by 'Ram Rai', the eldest son of the seventh Guru of the Sikhs, Sri Har Rai ji in 17th Century, Ram Rai Gurudwara in Dehradun is one of the oldest Gurudwara and a popular pilgrimage center of the Sikh religion. ",https://dehraduntourism.co.in/images/places-to-visit/header/guru-ram-rai-gurudwara-dehradun-tourism-entry-fee-timings-holidays-reviews-header.jpg
Dehradun,Trekking,3.9," Trekking has been one of the favourite activities among adventure travellers coming to Dehradun. Jwala Devi, George Everest, Bhadraj Temple, Shivalik ranges, Doon valley, Dakpather, Asan Barrage are some of the places for trekking from Dehradun. Pachhwadun region is one of the starting points for a lot of treks. ","https://ts-production.imgix.net/images/mobile-cover-uploaded/9d9cce89-5079-43e6-adbf-3f85070db032.jpeg?auto=compress,format&w=800&h=450"
Dehradun,Tiger View Jungle Camp,3.1," Situated in the village Goolar Khalla, Tiger View Jungle camp shelters the endangered Indian Tiger. You can take the jungle safari, and enjoy the rare facility of camping in the wilderness. ",https://www.hlimg.com/images/things2do/738X538/l_1524120907t.jpg
Dehradun,Bali Pass,3.5," One of the least explored treks in the Indian Himalayan region that connects the Har Ki Dun Valley with Yamunotri, the Bali Pass Trek is a beautiful journey that one should try at least once in a lifetime.  ",https://i.ytimg.com/vi/XX5y59tE-p0/maxresdefault.jpg
Dehradun,Zonal Museum,3.1," The zonal museum is popular for its collection of artifacts relating to the origin, development and sustenance of the mankind on earth, and stands witness to the ancient living conditions and customs of its people. ",https://dehraduntourism.co.in/images/places-to-visit/header/zonal-museum-dehradun-tourism-entry-fee-timings-holidays-reviews-header.jpg
Chandigarh,Sukhna Lake,4.5," Sukhna Lake is a man-made lake and one of the most famous attractions in Chandigarh. With its pristine blue water, it is frequented by morning joggers and walkers. Boating, rowing, trampoline jumping and solar cruise are popular activities here. Sukhna Lake also houses Siberian ducks and cranes. ",https://images.hindustantimes.com/rf/image_size_960x540/HT/p2/2020/03/02/Pictures/chandigarh-february-february-chandigarh-weather-visitors-enjoying_b12974dc-5ca4-11ea-be04-6cf974e2d9f7.jpg
Chandigarh,Rock Garden,4.6,The Rock Garden is a massive open-air exhibition hall that displays sculptures made from urban and industrial wastes that have been designed and executed by Nek Chand. It also consists of man-made interlinked waterfalls. The popular Teej festival is also celebrated here each year.,https://www.revv.co.in/blogs/wp-content/uploads/2021/12/Rock-Garden-Chandigarh.jpg
Chandigarh,Elante Mall,4.3," Elante Mall is the second-largest mall of Chandigarh situated in Industrial Area Phase 1. It comprises of various Indian and international brands, a food court and various cafes. ",https://blogger.googleusercontent.com/img/b/R29vZ2xl/AVvXsEjUfNN1KJuYd4xC72EB4yIjmmcGCuP6xFnca6i6ndMByjH2c2RxL4I57qLISxNZhfN59Lf5yMVwDy4ccXpwE5435rmRJAcrZKXPwTx-XHjzPE0nh4-FE1XhkaTOlAsmnOyblSO34G6fJBdwV1Tokrw7SBB3FFJisSUnqsOwBf3s9AhWtMYra-k0UxkxFw/s773/Elante_mall_photos.PNG
Chandigarh,Rose Garden,4.2," Located in sector 16 of Chandigarh, Rose Garden is a blooming exhibit that showcases around 825 varieties of flowers and 32,500 varieties of trees and medicinal shrubs. Also known as Zakir Hussain Rose Garden, it is quite popular among tourists and nature enthusiasts.  ",https://ootyhoneymoon.com/wp-content/uploads/2015/01/4-days-honeymoon-packages-800x600.jpg
Chandigarh,Government Museum and Art Gallery,4.2," The Government Museum and Art Gallery is a natural history museum and an art gallery in Chandigarh. The building is typically is square of 165x165 feet. The following sections are present at the institute, other than the gallery itself - The National History Museum, the National Gallery of Portraits and the Chandigarh Architecture Museum, each with further sections of their own.  ",https://www.trawell.in/admin/images/upload/47276334Chandigarh_Government_Museum_and_Art_Gallery_Main.jpg
Chandigarh,International Dolls Museum,4.0," International Dolls Museum contains a wide collection of fascinating dolls and marionettes brought from countries like Germany, Denmark, Netherlands, Spain, Korea, and Russia that stand beside the huge Indian collection. ",https://res.cloudinary.com/purnesh/image/upload/f_auto/v1568276969/doll-museum-4.jpg
Chandigarh,The Capitol,4.5," Housing the Legislative Assembly, the Secretariat, the High Court and the Capitol designed by Le Corbusier is another architectural marvel composed of twofold cover, which appears like an overturned umbrella. ",https://aviationweek.com/sites/default/files/styles/crop_freeform/public/uploads/2019/11/uscapitolwestside.jpg?itok=WbhOmtzj
Chandigarh,Fun City,4.3," Fun City is the biggest water amusement park in North India. It boasts of one activity pool, three landing pools and a wave pool, a cluster of water slides of various shapes and sizes, which makes for a delightful ride for the water lovers. ",https://static-blog.treebo.com/wp-content/uploads/2022/12/Fun-city-1024x675.jpg
Chandigarh,Pinjore Gardens,4.5," Pinjore Gardens is a beautiful Mughal Garden made in 17th Century India located in the city of Pinjore, in the district of Panchkula, Haryana. Also known as Yadvinder Garden, this terraced garden is famous for its well-maintained greenery, refreshing fountains and mesmerising water bodies. ",https://www.holidify.com/images/cmsuploads/compressed/6203294389_f982320978_b_20180316121611.jpg
Chandigarh,Garden of Silence,4.2," Situated in Bhagwanpura, Chandigarh, Garden of Silence is a meditative space which houses a massive idol of Buddha. It offers a peaceful and tranquil atmosphere for meditation amidst lush green surroundings with a beautiful view of the Shivalik Ranges in the backdrop. ",https://www.trawell.in/admin/images/upload/472763425Chandigarh_Garden_of_Silence_Main.jpg
Mysore,Mysore Palace,4.4," The former residence of the royal family of Mysore, the Mysore Palace is an extremely breath-taking example of the Indo-Sarcenic style of architecture. It was built in the year 1912 for the 24th Ruler of the Wodeyar Dynasty, and is till date one of the biggest palaces in the country. It's one of the most popular and well known tourist attractions in India.  ",https://karnatakatourism.org/wp-content/uploads/2020/06/Mysuru-Palace-banner-1920_1100.jpg
Mysore,Brindavan Gardens,4.2," Built across the Kaveri river, these beautiful gardens were constructed by Krishnaraja Wodeyar. These gardens spread over 60 acres of land and were modeled after the Shalimar gardens of Kashmir. The beauty of these gardens multiplies in the evenings when the fountains light up in various colors. ",https://www.makemytrip.com/travel-guide/media/dg_image/mysore/Brindavan-Gardens-Mysore.jpg
Mysore,Mysore Zoo,4.3," Sri Chamarajendra Zoological Gardens, also known as the Mysore Zoo is one of the best zoological gardens in India. Along with being home to various species of birds, mammals and reptiles, this zoo also engages in captive breeding of exotic and endangered species. The world's first caesarian section delivery performed on an elephant in Mysore zoo gave it global fame and recognition. ",https://www.trawell.in/admin/images/upload/333510912MysoreZoo_Main.jpg
Mysore,Somanathapura Temple,3.5," The village is named after Somnath, the commander of the Hoysala army who founded this place. It has a perfect natural setting for a family picnic. Also, the Somnathpur temple is a classic example of the stone carvings in Hoysala architecture. ",https://upload.wikimedia.org/wikipedia/commons/d/da/Somanathapura_Keshava_Temple.jpg
Mysore,Chamundeshwari Temple,4.2," Built atop the Chamundi Hills, this temple dates back to the 12th century. The idol of the main deity is made of gold. Also featured in this temple is a intricately engraved seven storey Gopuram and a silver plated entrance. ",https://bxmysuru.com/wp-content/uploads/2022/08/Sri-Chamundeshwari-Temple9.jpg
Mysore,Shuka Vana,3.0," Home to over 2000 birds, the Shuka Vana in Mysore currently holds the record for most bird species in an aviary in the Guinness Book of World Records. This unique park, commonly known as parrot park, is a part of the Avadhoota Datta Peetham in the Sri Ganapathi Sachidananda Ashram, and also serves as a rehabilitation centre for abused, injured and abandoned birds. ",https://i.ytimg.com/vi/9OJaYHw0MCo/maxresdefault.jpg
Mysore,Jaganmohan Palace,4.2," The palace that housed the royals before the construction of The Mysore palace, this structure displays various paintings of the past kings of Mysore and is one of the oldest buildings in the city. ",https://www.inmysore.com/images/stories/mysore_attractions/jaganmohan_palace/jaganmohan_palace.jpg
Mysore,Bonsai Garden,3.1,The Bonsai Garden of Mysore is home to over a 100 different varieties of Bonsai trees spread across a vast estate of about 4 acres. It is a part of the Avadoota Datta Peetham of the Sri Ganapathi Sachidananda Ashrama.,https://i.ytimg.com/vi/29VeGkqUjWc/hq720.jpg?sqp=-oaymwEhCK4FEIIDSFryq4qpAxMIARUAAAAAGAElAADIQj0AgKJD&rs=AOn4CLDmOuHj6osm-Z00GsTPXzphVu9VaQ
Mysore,Rail Museum,3.7," The Mysore Rail Museum is the second of its kind in India, right after the National Railways Museum of Delhi. The museum depicts the journey and development of the Indian railways through an opulent collection of photographs and various other exhibits, housing a plethora of information and insight into the intricacies of the railway engine. ",https://ik.imagekit.io/yfnz71p9w/wp-content/uploads/2022/04/9.webp
Mysore,Karanji lake,3.8," Karanji Lake, also known as the fountain lake, is a popular picnic spot. Visitors are allowed to bring packed food, and there is a coffee shop as well. It is a beautiful place to explore the different species of birds as the lake exhibits as many as 147 species including herons, Asian openbill storks, cormorant, grey pelican, etc. ",https://www.holidify.com/images/cmsuploads/compressed/attr_1062_20190221181106jpg
